{
  "canonicalCommit": "1dc0392c6a36fe5f636848d7ea0ef5c62bb83c84",
  "canonicalOpenApiSha256": "aa59a0766bd9043bf634f9cfe09b01c8fb7e86871900b2c26409490de67e9f70",
  "generatedAt": "2026-08-05T05:47:27.320Z",
  "operations": [
    {
      "cleanup": "passed",
      "evidenceId": "probe-3fec7c02bee4de50-063",
      "observedHttpClass": "2xx",
      "operationId": "deleteWorkspacesWorkspaceIdClientsClientId",
      "operationKey": "DELETE /workspaces/{workspaceId}/clients/{clientId}",
      "proofKind": "sandbox-mutation",
      "requestShapeSha256": "2195bb6b835c0c04c69d791615c288a8a1c43ea935a4dff1d1ea4a1b85fbf3dd",
      "responseShapeSha256": "d33e6a78120356d0e2068636fa37fb1e674b4ac1e478009ade964ed1216d7206",
      "status": "live-success",
      "verifiedAt": "2026-08-05T05:44:48.312Z"
    },
    {
      "cleanup": "passed",
      "evidenceId": "probe-3fec7c02bee4de50-072",
      "observedHttpClass": "2xx",
      "operationId": "deleteWorkspaceCustomField",
      "operationKey": "DELETE /workspaces/{workspaceId}/custom-fields/{customFieldId}",
      "proofKind": "sandbox-mutation",
      "requestShapeSha256": "71395d75d231ef33a143ae42874c10c7e3c170b69ac7772b851c754d24b9c09c",
      "responseShapeSha256": "d33e6a78120356d0e2068636fa37fb1e674b4ac1e478009ade964ed1216d7206",
      "status": "live-success",
      "verifiedAt": "2026-08-05T05:44:49.173Z"
    },
    {
      "cleanup": "passed",
      "evidenceId": "probe-3fec7c02bee4de50-089",
      "observedHttpClass": "2xx",
      "operationId": "deleteExpense",
      "operationKey": "DELETE /workspaces/{workspaceId}/expenses/{expenseId}",
      "proofKind": "sandbox-mutation",
      "requestShapeSha256": "07239c5875f1644f7899c4b38a5ddca2277b2d3eb2b9265ccd60158c2d4fc1f7",
      "responseShapeSha256": "d33e6a78120356d0e2068636fa37fb1e674b4ac1e478009ade964ed1216d7206",
      "status": "live-success",
      "verifiedAt": "2026-08-05T05:44:51.177Z"
    },
    {
      "cleanup": "passed",
      "evidenceId": "probe-3fec7c02bee4de50-091",
      "observedHttpClass": "2xx",
      "operationId": "deleteExpenseCategory",
      "operationKey": "DELETE /workspaces/{workspaceId}/expenses/categories/{categoryId}",
      "proofKind": "sandbox-mutation",
      "requestShapeSha256": "246c57c4c9ade3aa1cb2ddb2878316551afaf4a7a0ded2380291a3557834a990",
      "responseShapeSha256": "d33e6a78120356d0e2068636fa37fb1e674b4ac1e478009ade964ed1216d7206",
      "status": "live-success",
      "verifiedAt": "2026-08-05T05:44:51.316Z"
    },
    {
      "cleanup": "passed",
      "evidenceId": "probe-3fec7c02bee4de50-133",
      "observedHttpClass": "2xx",
      "operationId": "deleteHoliday",
      "operationKey": "DELETE /workspaces/{workspaceId}/holidays/{holidayId}",
      "proofKind": "sandbox-mutation",
      "requestShapeSha256": "f7aa953b599d5101091163985db5b0168586534cc8270bc4e4fffd5c857fb681",
      "responseShapeSha256": "d6538d3e893971e282865554074c41778dc946584618585c3fafeaba98a55c8c",
      "status": "live-success",
      "verifiedAt": "2026-08-05T05:45:15.969Z"
    },
    {
      "cleanup": "passed",
      "evidenceId": "probe-3fec7c02bee4de50-097",
      "observedHttpClass": "2xx",
      "operationId": "deleteInvoice",
      "operationKey": "DELETE /workspaces/{workspaceId}/invoices/{invoiceId}",
      "proofKind": "sandbox-mutation",
      "requestShapeSha256": "c291b0fceb418fc1a5bd53c4fdfc3906d4c13b2b3544e17c61232871634fd8f4",
      "responseShapeSha256": "d33e6a78120356d0e2068636fa37fb1e674b4ac1e478009ade964ed1216d7206",
      "status": "live-success",
      "verifiedAt": "2026-08-05T05:44:52.475Z"
    },
    {
      "operationId": "deleteInvoiceItem",
      "operationKey": "DELETE /workspaces/{workspaceId}/invoices/{invoiceId}/items/{order}",
      "status": "documented"
    },
    {
      "operationId": "deleteInvoicePayment",
      "operationKey": "DELETE /workspaces/{workspaceId}/invoices/{invoiceId}/payments/{paymentId}",
      "status": "probe-documented"
    },
    {
      "cleanup": "passed",
      "evidenceId": "probe-3fec7c02bee4de50-059",
      "observedHttpClass": "2xx",
      "operationId": "deleteProject",
      "operationKey": "DELETE /workspaces/{workspaceId}/projects/{projectId}",
      "proofKind": "sandbox-mutation",
      "requestShapeSha256": "d3f8d650772bed149ceb0c57a9357de60e2c086d3318e96fbab6f9a27449c954",
      "responseShapeSha256": "ccd64e37182bf7308debf0d40ea04b40c5e1c7c15a98c206ee913e9a3e60ef7c",
      "status": "live-success",
      "verifiedAt": "2026-08-05T05:44:47.942Z"
    },
    {
      "cleanup": "passed",
      "evidenceId": "probe-3fec7c02bee4de50-057",
      "observedHttpClass": "2xx",
      "operationId": "removeProjectCustomField",
      "operationKey": "DELETE /workspaces/{workspaceId}/projects/{projectId}/custom-fields/{customFieldId}",
      "proofKind": "sandbox-mutation",
      "requestShapeSha256": "57c022754631172b50203f76a52fc0a1726d3602b673e50664a09c83af3bfc00",
      "responseShapeSha256": "24c47fa7af34d6919d1f6c0ae02c985dd7b77740dc3cdf8f2796685129389d99",
      "status": "live-success",
      "verifiedAt": "2026-08-05T05:44:47.499Z"
    },
    {
      "cleanup": "passed",
      "evidenceId": "probe-3fec7c02bee4de50-069",
      "observedHttpClass": "2xx",
      "operationId": "deleteTaskFromProject",
      "operationKey": "DELETE /workspaces/{workspaceId}/projects/{projectId}/tasks/{taskId}",
      "proofKind": "sandbox-mutation",
      "requestShapeSha256": "0d3435672ad0ccb7ae60185e2957960405e020c429a9ffa9161bbae8f4f684c6",
      "responseShapeSha256": "d3edb11d864a406a0274a311edf5ce98f61ea583244821f4ab8abe4b868ecdab",
      "status": "live-success",
      "verifiedAt": "2026-08-05T05:44:48.951Z"
    },
    {
      "cleanup": "passed",
      "evidenceId": "probe-3fec7c02bee4de50-121",
      "observedHttpClass": "2xx",
      "operationId": "deleteRecurringAssignment",
      "operationKey": "DELETE /workspaces/{workspaceId}/scheduling/assignments/recurring/{assignmentId}",
      "proofKind": "sandbox-mutation",
      "requestShapeSha256": "d4eedd1fff7e2f733b05849a4f55967b82df71732e25f58ff42f9c1043bbdc2e",
      "responseShapeSha256": "2c42e3f7f59ef2d71465844cbc05872c173e22c3b53cd345ff409883b7bc8eee",
      "status": "live-success",
      "verifiedAt": "2026-08-05T05:45:14.294Z"
    },
    {
      "cleanup": "passed",
      "evidenceId": "probe-3fec7c02bee4de50-125",
      "observedHttpClass": "2xx",
      "operationId": "deleteWorkspacesWorkspaceIdSharedReportsSharedReportId",
      "operationKey": "DELETE /workspaces/{workspaceId}/shared-reports/{sharedReportId}",
      "proofKind": "sandbox-mutation",
      "requestShapeSha256": "0cd54a517d723f4e0b4242b1a5512e3d5456736fd88757da62f04fcf6f102ccc",
      "responseShapeSha256": "d33e6a78120356d0e2068636fa37fb1e674b4ac1e478009ade964ed1216d7206",
      "status": "live-success",
      "verifiedAt": "2026-08-05T05:45:14.948Z"
    },
    {
      "cleanup": "passed",
      "evidenceId": "probe-3fec7c02bee4de50-048",
      "observedHttpClass": "2xx",
      "operationId": "deleteWorkspacesWorkspaceIdTagsTagId",
      "operationKey": "DELETE /workspaces/{workspaceId}/tags/{tagId}",
      "proofKind": "sandbox-mutation",
      "requestShapeSha256": "e6047b170f86b11f11041c93d285b3a16fcc8661c3ebf47e422b07dd3f63a358",
      "responseShapeSha256": "d33e6a78120356d0e2068636fa37fb1e674b4ac1e478009ade964ed1216d7206",
      "status": "live-success",
      "verifiedAt": "2026-08-05T05:44:46.493Z"
    },
    {
      "cleanup": "passed",
      "evidenceId": "probe-3fec7c02bee4de50-078",
      "observedHttpClass": "2xx",
      "operationId": "deleteWorkspacesWorkspaceIdTimeEntriesTimeEntryId",
      "operationKey": "DELETE /workspaces/{workspaceId}/time-entries/{timeEntryId}",
      "proofKind": "sandbox-mutation",
      "requestShapeSha256": "9a6a441ba4a022603fcf5e413718b8cc2395de268e46c6ceffe55fe9411ad9c5",
      "responseShapeSha256": "d33e6a78120356d0e2068636fa37fb1e674b4ac1e478009ade964ed1216d7206",
      "status": "live-success",
      "verifiedAt": "2026-08-05T05:44:49.860Z"
    },
    {
      "cleanup": "passed",
      "evidenceId": "probe-3fec7c02bee4de50-112",
      "observedHttpClass": "2xx",
      "operationId": "deleteBalanceAssignment",
      "operationKey": "DELETE /workspaces/{workspaceId}/time-off/balance/assignment/{balanceAssignmentId}/user/{userId}/policy/{policyId}",
      "proofKind": "sandbox-mutation",
      "requestShapeSha256": "e6fd75e78135ae53174facb4ef1428af7be4cb066cbbc74341c0eaedb162ef99",
      "responseShapeSha256": "d33e6a78120356d0e2068636fa37fb1e674b4ac1e478009ade964ed1216d7206",
      "status": "live-success",
      "verifiedAt": "2026-08-05T05:45:11.656Z"
    },
    {
      "cleanup": "passed",
      "evidenceId": "probe-3fec7c02bee4de50-116",
      "observedHttpClass": "2xx",
      "operationId": "deleteTimeOffPolicy",
      "operationKey": "DELETE /workspaces/{workspaceId}/time-off/policies/{policyId}",
      "proofKind": "sandbox-mutation",
      "requestShapeSha256": "4ceb4ade6f0871b571f8c11b14931dd3c79fb5df1a7c3fe93d606806864c3c18",
      "responseShapeSha256": "d33e6a78120356d0e2068636fa37fb1e674b4ac1e478009ade964ed1216d7206",
      "status": "live-success",
      "verifiedAt": "2026-08-05T05:45:13.498Z"
    },
    {
      "cleanup": "passed",
      "evidenceId": "probe-3fec7c02bee4de50-114",
      "observedHttpClass": "2xx",
      "operationId": "deleteTimeOffRequest",
      "operationKey": "DELETE /workspaces/{workspaceId}/time-off/policies/{policyId}/requests/{requestId}",
      "proofKind": "sandbox-mutation",
      "requestShapeSha256": "93e81c2eb9e27777a38032afc57bdd8c64d214e70d19cb67094f53028a9acffd",
      "responseShapeSha256": "3629cae37e35dc6eb840a13fe9d6fc3e04ed26982a28f6262eb29a30b13dbe7f",
      "status": "live-success",
      "verifiedAt": "2026-08-05T05:45:11.926Z"
    },
    {
      "cleanup": "passed",
      "evidenceId": "probe-3fec7c02bee4de50-130",
      "observedHttpClass": "2xx",
      "operationId": "deleteGroup",